{
  "contract_version": 1,
  "workspace_id": "workspace.sample",
  "lease_id": "lease.sample",
  "generation": 0,
  "files": [
    {
      "logical_path": "README.md",
      "sha256": "c97ace4c8fef2cee8fa0f3c9f52aab18dbd4f42438afe362ffb8f75ce4c04b84",
      "byte_length": 6
    },
    {
      "logical_path": "src/lib.rs",
      "sha256": "2cf24dba5fb0a30e26e83b2ac5b9e29e1b161e5c1fa7425e73043362938b9824",
      "byte_length": 5
    }
  ],
  "snapshot_digest": "286f81f4be0ef63b94ad9c6bcaf2cab731bc5baab893f3bdb1475f204c799029"
}
